{
  "schemaVersion": "overlay-state/v1",
  "generatedAt": "2026-08-12T10:00:00Z",
  "health": { "status": "healthy", "renderSafe": true, "emergencyHidden": false, "maxSilenceMs": 1250 },
  "display": {
    "visible": true,
    "family": "objective-exchange",
    "kicker": "直播洞察 · 目标交换",
    "title": "肉山换两塔，地图资源完成对冲",
    "body": "夜魇取得不朽之守护；天辉同期拆除两座外塔，经济差变化保持在可控区间。",
    "evidence": "观察窗口 38 秒 · 建筑 2 座 · 肉山状态已确认",
    "confidenceLabel": "高置信度",
    "sourceLabel": "实时观察 · 本地状态",
    "ageLabel": "更新于 1 秒前",
    "asset": null
  }
}
